{
  "contract_version": "1.0.0-draft.1",
  "config_id": "cfg-rum-web-default",
  "scope": {
    "tenant_id": "tenant-shop",
    "project_id": "project-web-prod"
  },
  "revision": 13,
  "status": "active",
  "lifecycle": {
    "operation": "rollback",
    "rollback_of_revision": 9,
    "reason": "restore stable sampling policy"
  },
  "etag": "cfg-rum-web-default-r13",
  "created_at": "2026-07-26T09:00:00Z",
  "created_by": "control-plane-admin",
  "activated_at": "2026-07-26T09:01:00Z",
  "activated_by": "control-plane-admin",
  "document": {
    "config_version": "cfg-rum-web-default-r13",
    "issued_at": "2026-07-26T09:01:00Z",
    "expires_at": "2026-07-27T09:01:00Z",
    "protocol_version": "1.0.0-draft.1",
    "encoding": "protobuf",
    "compression": "gzip",
    "sampling": {
      "session_rate": 0.1,
      "trace_rate": 0.05,
      "replay_rate": 0,
      "always_keep_events": ["rum.error", "rum.http.failure"]
    },
    "privacy": {
      "policy_id": "nebula-default-deny",
      "policy_version": "1.0.0-draft.1",
      "default_action": "drop"
    },
    "upload": {
      "endpoint": "/rum/v1/batches",
      "batch_max_records": 100,
      "batch_max_bytes": 262144,
      "flush_interval_millis": 5000
    },
    "instrumentation": {
      "navigation": true,
      "resource": true,
      "web_vitals": true,
      "long_tasks": true,
      "fetch_xhr": true,
      "errors": true,
      "console": false,
      "trace_allow_origins": ["https://api.example.com"],
      "trace_deny_origins": []
    },
    "kill_switch": {
      "disable_all": false,
      "disable_replay": true,
      "disable_network_body": true,
      "disable_console": true,
      "disable_trace_propagation": false,
      "disable_webview_bridge": true
    },
    "key_id": "config-key-2026-01",
    "signature": "BASE64_SIGNATURE_FIXTURE"
  }
}
